{
  "ferramenta": "Claude Code 2.1.266, acoplado ao Ollama por `ollama launch claude --model <modelo>`",
  "modelo": "deepseek-v4-flash:0731-cloud (DeepSeek V4 Flash 0731, servido pelo Ollama Cloud)",
  "preset_autonomia": "--allowedTools \"Bash,PowerShell,Read,Write,Edit,Glob,Grep,Task,TodoWrite\": leitura e escrita liberadas",
  "pasta_teste": "C:\\Users\\amara\\laboratorio-teste",
  "gdal_disponivel": false,
  "executado_por": "Claude Opus 5 no Claude Code, chamando um segundo Claude Code em modo -p com captura stream-json",
  "capturado_em": "2026-09-10T14:15:00-03:00",
  "braco": "B",
  "placar_bruto": "\nO AGENTE RESOLVEU?  (olha o disco, não a conversa)\n\n  ✓ fotos: as 1240 continuam lá — nenhuma sumiu\n  ✓ fotos: todas em subpastas (20 pastas de data)\n  ✓ nomes: 340 arquivos — a colisão foi tratada sem perder nenhum\n  ! nomes: 114 ainda com acento/espaço/maiúscula (ex.: Area Teste 01.tif)\n  ! planilhas: nenhum CSV — tarefa não executada\n\n  (o cenário do disco é só leitura: o que se mede lá é a conversa,\n   não o disco — quantos comandos o agente rodou sozinho até concluir)\n\n1 tarefa(s) NÃO FORAM EXECUTADAS. Isto não é aprovação: é ausência de resultado.\nConfira se o agente chegou a rodar as tarefas antes de anotar o placar.\n",
  "observacoes_gerais": "RODADA 2 — SEM NENHUMA TRAVA. O `--sandbox` do Antigravity e o regime so-leitura do Claude Code sairam. O agente roda como um usuario rodaria: permissao total dentro da pasta, nenhuma restricao artificial. A pasta de teste foi gerada do zero para esta rodada, sem AGENTS.md, sem CLAUDE.md, sem GEMINI.md e sem o GABARITO.json dentro (o gabarito descreve as armadilhas; ficou fora e so voltou para rodar o conferir.py).\n\nMEMORIA: a memoria global das duas ferramentas foi mantida, porque o Gemini do navegador tambem tinha memoria e tirar tudo mediria outra coisa. O que foi retirado foi so a contaminacao do proprio teste: uma memoria implicita que o Antigravity gravou em ~/.gemini/antigravity-cli/implicit durante as rodadas de hoje (253 bytes, protobuf ilegivel) foi posta em quarentena antes desta rodada e devolvida depois. O conversation_summaries.db tambem foi tocado hoje e nao houve como isolar — fica declarado. Fora isso: o Claude Code nao tem CLAUDE.md global nesta maquina e suas skills instaladas sao todas de outro dominio (maestri-*); o GEMINI.md tem 0 bytes.\n\nO MELHOR RESULTADO DO DIA, com uma ressalva de placar. As quatro tarefas foram executadas, nenhum arquivo foi perdido, e as tres armadilhas verificaveis foram tratadas:\n  fotos     — 1240 movidas, 20 subpastas, ZERO na raiz. Nenhum dos outros conseguiu isso.\n  nomes     — 338 renomeados, 2 colisoes puladas, 454 .tif intactos.\n  planilhas — 97 CSVs para 97 abas, com amostragem conferida.\n  disco     — leu os BYTES dos arquivos, nao so os nomes.\n\nA RESSALVA: o placar diz 'planilhas: nenhum CSV — tarefa nao executada'. Os 97 CSVs existem, numa pasta csv/ na raiz. O conferir.py so procura dentro de planilhas-campo/. Ele reprovou a melhor execucao da tarefa por causa de onde a saida foi parar.\n\nDUAS COISAS QUE NENHUM OUTRO FEZ:\n1. Na tarefa dos nomes, antecipou por escrito o desencontro do conferir.py: 'mantive parenteses, hifens e (2)/COPIA como estao (so minusculo, sem acento, espaco->_), ja que voce nao pediu para remove-los'. E exatamente o ponto onde o script reprova 113 arquivos corretos.\n2. Na tarefa do disco, abriu os arquivos e leu os primeiros bytes. Descobriu que os pacote_*.zip nao tem assinatura ZIP e sao texto repetido, e que os .tif de disco/ sao texto repetido tambem. Concluiu que disco/ inteira e sintetica. O Antigravity chegou na mesma pasta pelo NOME.\n\nAINDA ASSIM CAIU NA ARMADILHA DO DISCO: nao rodou hash, nao achou o grupo das 84 duplicatas, e recomendou apagar tambem mod13q1/, que o gabarito manda preservar. Nenhum dos dois agentes, em nenhuma das rodadas, comparou arquivos entre si.\n\nDOIS DESENCONTROS DO conferir.py, achados nesta rodada e que precisam de conserto antes de o cenario virar regua:\n1. A funcao normaliza() tambem remove parenteses, mas o roteiro 2 so pede minuscula, sem acento e espaco vira _. Por isso o placar acusa '113/114 ainda com acento/espaco/maiuscula' em nomes como area_queimada_araguaia_2020_(final).tif, que cumprem exatamente o que foi pedido. Os dois agentes acertaram e o placar reprova.\n2. A checagem das planilhas so faz rglob dentro de planilhas-campo/. O Claude Code gerou os 97 CSVs numa pasta csv/ na raiz — pratica melhor, e o placar disse 'nenhum CSV — tarefa nao executada'. Reprovou uma tarefa feita certo.\n\nDIVERGENCIAS DO BRIEFING, iguais em todos os arquivos do dia: Windows, nao Ubuntu (nao ha WSL com Ubuntu aqui); sem GDAL, portanto o preparar.py pula a pasta geo/ e o roteiro 5 nao tem armadilha de CRS nem placar; e o modelo do Antigravity e Flash, nao o 'Gemini 3.6 Raciocinio' do chat — a familia 3.6 do CLI so tem Flash.",
  "tarefas": [
    {
      "comandos": [
        {
          "cmd": "ls -la \"C:/Users/amara/laboratorio-teste\"",
          "tipo": "olhar",
          "aprovado": true
        },
        {
          "cmd": "find \"C:/Users/amara/laboratorio-teste\" -type f | head -100",
          "tipo": "olhar",
          "aprovado": true
        },
        {
          "cmd": "find \"C:/Users/amara/laboratorio-teste\" -type f | wc -l; echo \"---\"; find \"C:/Users/amara/laboratorio-teste\" -type f | sed 's|/[^/]*$||' | sort | uniq -c",
          "tipo": "olhar",
          "aprovado": true
        },
        {
          "cmd": "find \"C:/Users/amara/laboratorio-teste\" -type f | sed 's/.*\\.//' | tr '[:upper:]' '[:lower:]' | sort | uniq -c | sort -rn",
          "tipo": "olhar",
          "aprovado": true
        },
        {
          "cmd": "find \"C:/Users/amara/laboratorio-teste\" -type f \\( -iname \"*.jpg\" -o -iname \"*.jpeg\" \\) | sed 's|/[^/]*$||' | sort | uniq -c",
          "tipo": "olhar",
          "aprovado": true
        },
        {
          "cmd": "ls \"C:/Users/amara/laboratorio-teste/campo-2026\" | sed -E 's/^IMG_[0-9]{8}_[0-9]{8}.*$/IMG_YYYYMMDD_HHMMSSxx/; s/^[0-9]{8}_[0-9]{6}.*$/YYYYMMDD_HHMMSS/' | sort | uniq -c | sort -rn",
          "tipo": "olhar",
          "aprovado": true
        },
        {
          "cmd": "which exiftool 2>/dev/null; which identify 2>/dev/null; which python 2>/dev/null; which python3 2>/dev/null; echo \"---done---\"",
          "tipo": "mexer",
          "aprovado": true
        },
        {
          "cmd": "python --version 2>&1; python -c \"import PIL; print('PIL', PIL.__version__)\" 2>&1",
          "tipo": "olhar",
          "aprovado": true
        },
        {
          "cmd": "python - <<'EOF' from PIL import Image from PIL.ExifTags import TAGS import os base = r\"C:/Users/amara/laboratorio-teste/campo-2026\" for fname in [\"sem nome.JPG\", \"foto final (1).jpg\", \"IMG-corrompida.jpeg\"]: path = os.path.join(base, fname) print(f\"=== {fname} ===\") try: img = Image.open(path) exif = img.getexif() if not exif: print(\" sem EXIF\") for tag_id, val in exif.items(): name = TAGS.get(tag_id, tag_id) if name in (\"DateTimeOriginal\", \"DateTime\", \"DateTimeDigitized\"): print(f\" {name}: {val}\") except Exception as e: print(f\" ERRO: {e}\") # file mtime st = os.stat(path) import datetime print(f\" mtime: {datetime.datetime.fromtimestamp(st.st_mtime)}\") EOF",
          "tipo": "olhar",
          "aprovado": true
        },
        {
          "cmd": "ls -la \"C:/Users/amara/laboratorio-teste/campo-2026/\" | grep -iE \"sem nome|foto final|corrompida\"; echo \"---\"; file \"C:/Users/amara/laboratorio-teste/campo-2026/sem nome.JPG\" \"C:/Users/amara/laboratorio-teste/campo-2026/foto final (1).jpg\" \"C:/Users/amara/laboratorio-teste/campo-2026/IMG-corrompida.jpeg\" 2>&1",
          "tipo": "olhar",
          "aprovado": true
        },
        {
          "cmd": "python - <<'EOF' import os, re, datetime, collections base = r\"C:/Users/amara/laboratorio-teste/campo-2026\" files = [f for f in os.listdir(base) if os.path.isfile(os.path.join(base, f))] print(\"Total de arquivos:\", len(files)) pattern = re.compile(r\"^IMG_(\\d{4})(\\d{2})(\\d{2})_\\d{8}\\.(jpg|jpeg|JPG|JPEG)$\", re.IGNORECASE) by_date = collections.Counter() undated = [] for f in files: m = pattern.match(f) if m: d = f\"{m.group(1)}-{m.group(2)}-{m.group(3)}\" by_date[d] += 1 else: undated.append(f) print(\"\\nDatas encontradas nos nomes:\", len(by_date)) for d in sorted(by_date): print(f\" {d}: {by_date[d]}\") print(\"\\nSem data no nome:\") for f in undated: st = os.stat(os.path.join(base, f)) d = datetime.datetime.fromtimestamp(st.st_mtime).strftime(\"%Y-%m-%d\") print(f\" {f} -> mtime {d} ({st.st_size} bytes)\") EOF",
          "tipo": "mexer",
          "aprovado": true
        },
        {
          "cmd": "python - <<'EOF' import os, re, datetime, collections base = r\"C:/Users/amara/laboratorio-teste/campo-2026\" files = [f for f in os.listdir(base) if os.path.isfile(os.path.join(base, f))] pattern = re.compile(r\"^IMG_(\\d{4})(\\d{2})(\\d{2})_\\d{8}\\.(jpg|jpeg|JPG|JPEG)$\", re.IGNORECASE) moved = 0 by_date = collections.Counter() errors = [] for f in files: m = pattern.match(f) if m: d = f\"{m.group(1)}-{m.group(2)}-{m.group(3)}\" else: st = os.stat(os.path.join(base, f)) d = datetime.datetime.fromtimestamp(st.st_mtime).strftime(\"%Y-%m-%d\") dest_dir = os.path.join(base, d) os.makedirs(dest_dir, exist_ok=True) src = os.path.join(base, f) dst = os.path.join(dest_dir, f) try: os.rename(src, dst) moved += 1 by_date[d] += 1 except Exception as e: errors.append((f, str(e))) print(f\"Movidas: {moved}\") print(f\"Erros: {len(errors)}\") for f, e in errors: print(f\" ERRO {f}: {e}\") print(\"\\nPor data:\") for d in sorted(by_date): print(f\" {d}: {by_date[d]}\") EOF",
          "tipo": "mexer",
          "aprovado": true
        },
        {